,0
1017,"44:50 ""nato is a defensive alliance"", ok enough of your one sided propaganda.  Did you forget when nato bombed an independent Yugoslavia in 1999?  no nato country was under any threat from Yugoslavia.  There was nothing defensive about that bombing."
1018,I don't think I've seen a less informed discussion about what has been going on in the current conflict on the internet.  Congrats Lex.
1019,Сталин вообще-то не russian!
1020,Huge respect for Stephen Kotkin from Ukraine. One of the few public speakers I hear in the West who gets the situation so well.
1021,"Not here to simp for Lex but just wanted to say this guest is far far lest intelligent as i had hoped and he is delusional to the point that his bias and ideology blinds him to the truths and reality of his description of what happened, what is happening, and what will or what is the best out come....I disagree with all he said so dont let his big words fool you"
1022,"As I conclude from this interview, the West is ""very good and wants to help everyone"". Then explain to me why that same West disintegrated Yugoslavia and bombed my country, Serbia, without UN permission. Does that also belong to ""helping the poor people"". I just ask how you are not ashamed and how you are not ashamed of your actions, you who do not stop fighting and destroying other countries all this time since the end of the Second World War. And all under the pretext of ""help""."
1023,"Lex has the best podcast going, but he has a massive blindspot for Putin/Russia and what theyre doing right now"
1024,"He's great, but he is too western. For example our financial system is a complete mess"
1025,"I have a hard time listening to this speaker without getting emotional. He draws Russia and its history from a purely western perspective. As if the western values could be applied to Russian thinking and acting. With this he makes exactly the same mistakes as the western political leaders who think that they can impose their values on other ethnicities, regions and countries. Doing that they use means like extortion monetary control, wars, atrocities conducted by their intelligence services, militarily in order to provoke those nations which they want to control. And once those Nation States use means available to them including becoming more undemocratic the West uses those as justification to provoke civil unrest, forced government change in those countries. This speaker while historically probably very knowledgeable from a western perspective lacks to capacity to put himself into the shoes of those leaders."
1026,Such a shame to see a great historian be so one sided...
1027,"38:00 I observed of the treaties signed by Russia, as indicated by the historian, there is a clause of Russia's complain: Countries can freely choose their military alliances, but that should not be done at the expense of another country's security.

Also there is an assumption of reports of genocidal actions of the Russian army as true."
1028,"Honestly does this historian live in the archives does he forget the last twenty years .Iraq Syria Libya Afghanistan Yemen 
American Imperium encouraged NATO members to support the narrative"
1029,Wow. An incredible interview. I was not aware of Stephen Kotkin before this video. His knowledge and insight brings to mind  Joseph Campbell. Understanding context thru the noise is so important in these Orwellian times. I appreciate all you are doing Lex - thank you from a grateful fellow human.
1030,"So many lies. Kotkin might not be the Prince of Lies, but he is at least an Earl -- maybe a Marquess of Lies."
1031,"This guy is good at ""appealing to the emotions of the listener""

The rape analogy.
The description of Zelenskyy not leaving the country.

salute to Lex from Kenya!"
1032,"I stopped listening when Kotkin said we are not living in a multi-polar world. If you can make that sort of mistake, you are not to be taken seriously."
1033,"There is a saying history is written by victors (allegedly). His employer should be happy with a good return on investment. Jokes apart, this guy is obviously biased..."
1034,Many Russian words that are hard to translate to English. Very subtle.
1035,"China be like: Tibet is us and we want to retake the full extent of what Tibetan King Trisong Deutsen ruled in the 8th Century. This includes Bhutan, Sikkim, Ladakh, and Arunachal Pradesh. I’m hearing this from sources in India."
1036,try get Anthony Chaffee MD on podcast
1037,This guy is in a bubble of his own thinking
1038,"It's bizarre the extent to which he believes a war can be won on ""Twitter"". Truly, truly bizarre. John Mearsheimer makes much more sense. ""Twitter"" utterly irrelevant to battlefield victory."
1039,"""Countries are sovereign and free to choose their own foreign policy..."" well unless you are an autocratic country or you are Cuba or you are any Country in the West Hemisphere.."
1040,Thank you for another great interview. Please stay safe! ️
1041,Thank you so much for this Outstanding Interview! I really appreciated  Stephen Kotkin and his perspective of history.. It was thoroughly engaging and thought provoking.  I could listen to it again...Wishing you both All the Very Best.
1042,"there is so much more info the would challenge all being said by Stephen Kotkin. For instance footage of Lindsey ,McCain and a woman who's name I cant recall from 2020 I think talking about encouraging Ukraine's if not Nazis that when they have conflict with Russia as we encourage we would back them give them all they need. And a few other pieces of info points this to be a proxy war. And I am discouraged at the lack of awareness."
1043,Thank you for your interview it was captivating and emotionally stimulating
1044,Rod Serling and Charlie Rose merged. Lex is the outcome.
1045,Bring back Kotkin anytime!
1046,Truly an excellent interview on so many levels. Thank you Mr Fridman and Mr Kotkin.
1047,This was a great interview!
1048,Kotkin seems biased.
1049,"Thanks for the deeply insightful interview, Lex. Best on your travels."
1050,this guy is super strong in logic but very close minded
1051,"44:59
"" Nato doesn't attack , it defends members if they are attacked ""
Which member of NATO did Serbia attack in 1999 ?"
1052,Thanksgiving to you from all of us in question on so many things. Shedding light on tough subjects is always worth it no matter the cost.
1053,AMAZING interview from both sides. Much respect and thanks for this work.
1054,He sounds like the propaganda we are fed usually. Like what realistic reasons did he give for russia's invasion? Personality?
1055,"I saw you on someone else podcast, I've watched 3 of yours this morning, absolutely fantastic"
1056,Absolutely Love stephen kotkin. Started every sentence with 'Lex' and sounds just like Joe Pesci
1057,"You know, Lex, I've observed that when someone repeats your name over and over, Lex, while they're talking, that, Lex, they're probably not very trustworthy. Lex, they're probably some kind of cheap salesman or manipulator. I have no proof of this, Lex, nor do know whether your guest's opinion, Lex, is right or wrong. But, Lex, I don't trust him. Just sayin', Lex."
1058,"Such a great interview, very informative !"
1059,"Fantastic, the most insightful interview on this subject I have heard. Period."
1060,This is the best analysis I have heard. Great interview. thank you
1061,Thank You Lex for this conversation with Professor Kotkin. He is a remarkable teacher and has great gifts of comprehension and communication.
1062,Robert Leshner Please!
1063,Educational and Informative podcast!
1064,David Irving coming up?
1065,There is no danger in Ukraine for such a great human like Lex!
1066,Again thank you and may the world let you act as an agent of Love and Wisdom !
1067,"Wow, what a great conversation. Please do Part 3 after a few months."
1068,"Kotkin has bought the Zelensky / US narrative big time, otherwise interesting."
1069,Thank you so much for this interview!
1070,YES!
1071,"I don't typically comment but have to express my gratitude for the humanity, insight, intimacy, and sheer magnitude of this conversation. Lex, from the bottom of my heart you inspire me to keep a keen, and critical eye on the present. Dr. Kotkin, as a fellow American that passionately loves history, thank you so much for learning Russian, and further thanks for the insight. Down from the ages - as it goes. Please keep writing. Thank you both for being open and inviting the public to participate in the discourse."
1072,"You are a light in this world with both your mind and words. Thank you, truly.  "
1073,Great interview Lex!
1074,That rape analogy is such bullshit!
1075,"i love you too Lex.......in the past weeks, i stumbled onto your podcasts, no screaming, intelligent discourse, i could go on and on. You are a Son of the Light, chaver, shalom, n."
1076,"I recommended you guys sometime ago,can I get person who invested with her Mrs Camilla mc Coy comment below"
1077,"YESSSSSSSS!!!! I've been waiting for this for this since the last time he was on. Thank you LEXXX! Kotkin is probably my fav Historian, its rare for a historian to have such charisma, his talk with Zizek was both brilliant and hilarious."
1078,"Lex - Thank you so much for being willing to be vulnerable and allowing this important analysis to be heard and available to all.  Your followers could certainly see and feel the emotional toll this broadcast took on you.  It is much appreciated.  Kotkin was amazingly concise and clear and human.  What an incredible podcast.    You are making the world a better place, one listener at a time.  Take care of yourself, you are doing fantastic work here."
1079,"Great interview. Thanks for these thoughts. What strikes though me is how Stephen depicts people in power as making emotion-based decisions - french desiring to be diplomatic superpower, usa trying to agree, russians feeling resentment. Also, expressing one person's statements as justification for the country's actions. I mean, just because Trump reached out to Putin, doesnt mean the entire US agreed with that. Trump or Biden doesnt reflect the entire US establishment. Putin also doesnt reflect the entire Russian government. Each country has many competing internal forces. I was hoping to more names, dates, quotes, and factual comparisons. All these ideas about ""blackening the image"", fighting the evil, ""good/bad guys"", ""freedom and unfreedom"", ""privacy of their own mind"", ""we are gonna punish"", ""to hell with this"" - this is not about history as a research subject. Too many broad concepts and generalisations. Presidents globally aren't some infants. I mean, Stephen is a historian. Can we hear chronology? Or a historian just for the title? Metaphors are relevant, no doubt. But still empty in terms of factual analysis. Stephen seems to use mostly cultural and worldview clash as a key lens in the interview. Also, seems to connect points really superficially and eventually say ""we have to be careful about definitive judgements""."
1080,"Love your interviews Lex, I have learned so much. But I think you should refrain from travelling to either countries until at least a year from now, it's just too dangerous at the moment."
1081,One of the best programs on YouTube.
1082,Bedankt
1083,"Thanks Lex.
You are the best!
We love you - be safe!"
1084,"I listened to the interview with Oliver Stone first and was a bit startled about Oliver's stance because he basically suggested that Putin was right to start this war. But, he never really did, because he never talked about the actual conflict, just all that, in his mind, led up to it. Now, I have met Oliver once on a film project (his film ""Alexander"" which I was happy to not have signed onto for obvious reasons"", and it was a bit of a surreal experience because Oliver is so inherently anti-American in his view of the ""establishment"" of his country. So, how objective can he actually be in regards to the US's decades-long engagement of Putin?
Now, listening to Kotkin, I am hearing a lot more rational thinking without an inherent prior bias. Even to the point where he states something that is so obvious: In America, you can criticize those in power for their decisions (which Stone loves to do) but in Putin's Russia, you might very well not see the light of another day if you do so. 
Of course, Oliver could never come to his conclusion (that people in the West have the freedom to speak their mind, even when it comes to their own government) because it would undermine a tremendous aspect of his self-perception: That he's one of the few American filmmakers to continually criticize his countries government and this fact alone makes whatever he creates so much more special than the work of other US filmmakers. It is his brand. But hey. Anyone can do it. But most filmmakers just find it too boring and a senseless exercise. 
On the other hand, Kotkin really strings it out in a way that is logical, makes sense, seems to track incredibly well with historical document. He's not a filmmaker. He a political analyst. 
Stone is just a filmmaker and has done his better work in fiction... embellishing and shaping his very personal take on historical moments. Fine ... but, in this particular instance, I prefer to listen to someone who clearly understands the narrative as it has played out and doesn't just want to bash the part of the US government in the last 40+ years relating to Russia. 
Heck, I am originally German, have worked in Russia on several occasions and still have some contacts there. I never perceive that the Russians I had contact with were fans of Putin, they just endured the fact that they lived under a dictator as long as they could go about their business of working in the film industry. 
That's all gone now and many are leaving the country. Putin is trying to ""make Russia great again"" and drag it back 40+ years into the past. As Trump tried with the US. 
I am happy to see that they are both failing and I hope it stays this way. 
My best wishes go out to the Ukrainian people, they are fighting a war that is for all of Europe, and I think that is being realized, along with the resulting food crisis. 
So, thumbs-up to Kotkin's clear view of the world as it unfolds and a thumbs-down for Stone who can't seem to crawl out of the foxhole from which he chooses to commentate as long as he can criticize the US establishment."
1085,"Lex, I have one big ask; bring on Alexander Dugin. Please do the entire interview in Russian and subtitle it."
1086,"Life is a game like scissors, paper, stone.  Except that the rules can be changed.  You still need to be lucky to win, so go make your luck as quickly as possible.
Very interesting after STONE.  Thanks very much for accessing a completely articulate realist.  Great guy."
1087,YESSS!!! Round 1 is one of my favorite interviews you’ve done and probably overall!! So excited to to watch this!!
1088,That rape analogy was desperate and pathetic
1089,"Lex, I love how you're giving so much different perspective on these topics. You are doing a great service. Thank you."
1090,This guy is so slimy and intellectually dishonest.
1091,We do not live in a Democracy. We live in a Constitutional Republic. That is all thank you.
1092,I get the sense that Mr Kotkin is an excellent scholar. Thanks to Mr Fridman for getting an interview with him.
1093,Literally the best one yet!
1094,"Great pod, Lex. Kotkin""s clear-eyed analysis is spot on. The truth hurts sometimes, as you can tell from all the Russian propaganda here in the comments. Keep up the great work."
1095,Nice to hear Mr Kotkin explain all the variables(bureaucrats) in the Putin government that aren't obvious. About the resolve of the West. And why Putin can afford to wait since he has already collapsed the Ukrainian economy and has already made territorial net gains.  We have yet to see how the Western Heavy Weapons are going to help the Ukrainians.
1096,Only 30 minutes in and I'm kinda thinking whats the point of finishing.  This guy is clearly a true believer in the mandate of America exceptionalism to spread its ideology across the world backed by military might which I find even more reprehensible than the naked and unapologetic versions of the same strategy found in the East.
1097,"Great conversation. Was personally outraged by the one with Oliver Stone, found that repugnant"
1098,The excellent timing of this interview as the geopolitical and economical world is entering a very dangerous and difficult period ahead. Let us hope that the Worlds leaders have studied history and will not commit past mistakes that dragged humanity to two devastating World wars. I hope that Oliver Stone watched this interview with Steven Kotkin. God Bless Lex 
1099,"Hey Lex, its such a joy to see videos from your channel this regularly. Keep it Active. 
Go, Go Lex ️"
1100,We need this guy to debate Oliver Stone
1101,Absolutely fantastic discussion. I started listening here on youtube and finished streaming on Spotify on the back porch with a whiskey in hand. Stephen Kotkin is a wonderful conversationalist with calm and reason. I didn't agree with everything Oliver Stone said but equally enjoyed that conversation. Keep up the good work Lex. Your discussions have purpose and are important.
1102,The interview was good however his analogy of a woman getting raped is an extremely poor one. I don't think it applies at all. Ukraine isn't/wasn't this completely innocent little country that Russia just decided to invade without any reason or warning whatsoever.
1103,Thank you again Lex. Love this interview.
1104,What nonsense. Ridiculous analogies and no understanding of Russian military strategy. Also naive.
1105,"Yes!! Been listening to the first episode with Kotkin 10-15 times, he is just too good!"
1106,"Don’t go Lex we need your voice not in prison. But I know you will go, for the blood of both runs through you. So my prayers go with you on this mission of love. So many prayers go with you."
1107,"Best Episode yet, Lex"
1108,"I agree with Putin's reasoning for invading Ukraine, If NATO was closing in on my borders I would have attacked as well. I also believe in freedom over non-freedom. Freedom is giving me the ability to say things I want to say on this platform. So it's hard to say who is the greater evil in this situation. But I can say that the West is no saint at all!!"
1109,"Stay safe Lex, the world really needs people like you who speak to the importance of love and understanding. Looking forward to your return, and to hearing about your experiences in Russia and Ukraine."
1110,"Stephen Kotkin is a refreshing academic's view of geopolitics, from the Oliver Stone's deliberately controversial point of view."
1111,thank you for having stephen kotkin on again. I listened to his last podcast after the war started and really wanted to know his thoughts now.
1112,Lex should interview Piero Scaruffi. Great podcast!!
1113,"This interview was so necessary after Oliver Stone. Thanks Lex, you are making a difference in many people’s lives."
1114,Cf the murder or Oles Buzina
1115,Just finished listening to it on over on spotify. I Just wanted to comment on how excellent this conversation was. Great job as usual Lex 
1116,i did not enjoy oliver stone episode and did not enjoy this one as well. ignorant and one-sided(not about being sided againts russian aggression but the hypocretic policy that westerns re following cuz i m also supporting ukraine.)
1117,It‘s so sweet how Kotkin playfully closes his eyes ️
1118,"Lex, this is without a doubt, your most interesting guest to date. Greetings from South Africa. Our government may claim neutrality in the Ukraine invasion but the thinking populace see it for what it is.  Please keep up the excellent work you are doing and visit us soon."
1119,"I find people strange who say your name every sentence Lex.

Right Lex?

What do you think Lex?

"
1120,One of my favourite interviews you did…  Kotkin is so crystal clear and explains exactly how it is.
1121,"Oh good, there are several of these. This is the first I heard Stephen Kotkin and it is compressed quality. Appreciation."
1122,"I didn't liked what Olver Stone said, but I got his point of view. You are one of my favorite youtubers, and I don't have many. What you are doing is widening our toughts, Thank You! I saw how hard it was for you to talk about this subject"
1123,"Wow, who knew Joe Pesci was so knowledgeable about Russian history!"
1124,So this guy is smart ay .
1125,"44:50 ""nato is a defensive alliance"".  What about when that ""defensive alliance"" bombed an independent Yugoslavia in 1999?"
1126,Lex literally facilitates creation of more valuable content than some other mainstream huge human organizations. If Ukraine series continues next guest should be from the other side.
1127,Easily among the Top 10 YT chans of the 2020s. Also: Paul Stamets is a treasure chest - please tap him!! Rogan can vouch & so can their last pod together.
1128,"Maybe a I'm nitpicking, but I hate how he keeps saying Lex' name. Seems very manipulative
Overal it's  a great conversation though (at 1 hour in)"
1129,"Would be amazing if you could get Richard Evans on the podcast - an amazing historian and intellectual, who in my opinion is one of the most analytical and unbiased intellectuals out there"
1130,Ok this guy seems really smart but isn't this exactly what Trump had kept in check?  ??
1131,"Scott Horton must get on the Lex Fridman Podcast. I love Stephen Kotkin and have listened to him for years, but I would be really interested to see how he responds to being challenged on the moral superiority of the west in geo politics Bc from what I can tell, his bias is very much towards the West."
1132,"""I love you all""
Aww.
So do we Lex.x️️
Tu es une personne merveilleuse et je suis certain que ton père est fier de toi 
Prends soin de toi et de tes proches. Nous vivons des moments difficiles, hérétiques, mais ton travail, le mien, et de toutes les bonnes âmes qui nous entourent changeront la face de notre maison à tous... Et qui, je souhaite, ne sera plus à vendre,
L'IA peut nous aider, à optimiser les répartitions tout en réduisant les conflits.

Azimov was a wize man 

Over"
1133,"This is the second time that I hear the great knock-out Kotkin mention Gandhi once in a lecture, out of the blue, and now in an interview, nobody forcing it upon him neither-, with kinda of a slightly and rapidly supressed admiration. I would be most grateful to you, Mr. Fridman, if on a third round with Stephen Kotkin -please don't let him long of the hook, who else do we have to turn to for insight in this seemingly cursed epoch?-, you could see fit to ask kim about Gandhi and non-violence as a national ""security policy"" in a geopolitical context populated with the national-grandeur-womanising ""leaders"" of sorts you happened to dwell upon in this podcast. Somewhere i feel Mr.Kotkin thinks well of Gandhi as an alternative nationbuilder even if he could not build an alternative nation at all in the always final realist end. He seemed to have stood for nothing Kotkin argues at length (in other videos on the tube) to deem necessary to create a nation that could acquire a free influence sphere, i.e. all the multiple powers America makes Russia so envious about, all the heavy hardware stuff, besides the values that is. Gandhi wanted nothing of that for modern India, and apart from the very profound Swadeshi-economy-ideal the spinningwheel and its kadhi stood for as a multivalent symbol, he appeared to barely tolerate steamtrains beside the much admired Singer sowing machine. And I think he would have had nothing to do with nowaday things that are called Stinger (missiles etc), not even considering the longrun national security interest of India. Nehru did not follow him in that, and could not make do with Gandhis wisdom after the British rolled out and he had to fight-modernise wholesale for India's place in the sun among the non-aligned countries pressed hard between the two cold-war blocks. So what is non-violence as an integral spiritual political nation building program (and not just a possibly useful -given that the British were after all, all in all good sports decolonisation strategy) worth in Stephen Kotkin well armed prudential world...? Gandhi was definitely thinking about economy, peace, ecology, sustainability avant-la-lettre in all their interactions and all kinds of important public issues we face and he was in no way a mere fakir in a loincloth (Churchill) pulling some uncanny tricks on the white man. So what was he, and what might he still be now in our age for Kotkin's penetrating gaze? I close my eyes and I can hear Kotkin come up with a resignated ""Ah Gandhi, shame that...""-statement. 
Could the new whole of a world grounded in wisdom old as the mountains Gandhi always stood for and realistically pretended India to follow him along in, and which he did not get from his follower-devotional-Bapudhji callers, could this integral Gandhi for some realistic but in its reasonableness unsuspected consideration on the part of Kotkin not have induced this, his ""shame that""- kinda statement I think I hear from his lips? I would like a man that can measure a perduring abyss (Stalin), have measure the durableness of a mountain like the Mahatma...
Thank you most gratefully for your very considerate work and God bless. Many wellwishing greetings to you from Nazareth, Belgium."
