,0
0,"Here are the timestamps. Please check out our sponsors to support this podcast.
0:00 - Introduction & sponsor mentions:
- Lambda: https://lambdalabs.com/lex
- Scale: https://scale.com/lex
- Athletic Greens: https://athleticgreens.com/lex and use code LEX to get 1 month of fish oil
- ExpressVPN: https://expressvpn.com/lexpod and use code LexPod to get 3 months free
- ROKA: https://roka.com/ and use code LEX to get 20% off your first order
2:19 - Putin and Stalin
13:09 - Putin vs the West
36:01 - Response to Oliver Stone
47:07 - Russian invasion of Ukraine
1:26:35 - Putin's plan for the war
1:34:33 - Henry Kissinger
1:40:28 - Nuclear war
1:51:01 - Parallels to World War II
2:13:47 - China
2:21:55 - World War III
2:29:24 - Navalny
2:33:41 - Meaning of life"
1,"I think this complement could be taken the wrong way, but these interviews remind me of Charlie Rose.  Minimalist studio, no distractions, interesting guests, calm delivery of thoughtful questions.  Lex is definitely filling a space that needs to be filled.  Well done"
2,It took me 11 hours to do the math but he said “Lex” more than any other guest combined 
3,"I love Stephen Kotkin. One of my fav historians, he should be much more widely known."
4,This interview was a certified classic!
5,"One of my favorite guests you’ve had on previously. Looking forward to listening to this one. Thanks for the great content, Lex."
6,"What an excellent interview. What fine people! Thank you for sharing your expertise and analysis, and something of yourselves."
7,"Having an interview with Stephen Kotkin and Oliver Stone to discuss Russia in such a short time period is a major achievement. I'm not sure exactly how to put it, but it can't be understated just how much insight we received in such a short time period."
8,"I’m blown away with the compassion, depth and overwhelming insight this conversation brings to the table. What a masterpiece! Thank you so very much, Stephen and Lex! 🫡"
9,I especially appreciated Dr. Kotkin’s take on how to live a purposeful life.  What an amazing scholar and human being.
10,"Lex I’m so glad that you allowed Stephen the time to fully develop his arguments, and Stephen, thank you for the compassion and logic."
11,This is the 2nd time I listen to this pod cast and I am in awwww as to all the points covered in such an amazing way.    I want to read all of Steven's writings.
12,"This was a great conversation. I enjoyed it. Your guest is very knowledgeable and I appreciated your ability as an interviewer to listen objectively. My only critique comes early in the conversation during the Putin vs the West timestamp. The United States does have some publicly noted history in attempting to destabilize perceived enemy nations and install pro-western regimes, especially if those regimes have a lot of assets to be acquired the biggest being oil, and utilize it to our gain. Even if everything Stephen says is true about western Europe and United States being very welcoming to Russia throughout the years it does not change the fact that Putin is aware of the West's previous tactics in other countries. This coupled with his own training in ideological subversion, and economic warfare when he was an officer with the KGB it would no doubt make for a very heightened and suspicious individual who is aware Russia posses a lot of assets to be gained by west Europe and The United States, and he has seen we are not above destabilizing a country and leaving it's citizen's in shambles as a means to our own gain. This is by no means a support for Putin or the horrors of autocracy. However I think it needs to be noted because without all the nuances the bigger picture cannot be objectively and precisely formed. If the United States wants larger countries that posses a potential superpower risk such as Russia or China to become our allies then we need to prove we are universally trustworthy.
edit: 
And overstaying our time in the middle east, while attempting a regime change in Iraq and then our hasty sloppy withdrawal from Afghanistan was not and is not a good universal look. Not to mention our dependency on the abuse of Asia's cheap labor force so that we can live privileged lives filled with inexpensive things. Let's always promote freedom and democracy but also do our best to look at the biggest picture possible when doing so, because if we don't our freedom might be coming at the cost of someone else's enslavement."
13,"As an 80 years old Dane living in Denmark on a small Island called Fejoe, I am trilled to listen to this interwiev. IT gives me an outwiev og the greater political situation. I am indeed thankful for this posibily."
14,"What a relief listening to this after the Stone thing.
Thx for the great podcast"
15,Outstanding! Thank you Lex & Stephen 
16,I love listening to Stephen :-D Stuff happens.... That is priceless from a renowned professor. Nonetheless very true. Nobody has perfect information and the ability to process it.
17,I admire Stephen Kotkin so much.Lex you did a great job!x
18,"""Lex"" - Most used word in this Podcast! - Amazing listen, thank you!"
19,"Thank you, Lex, for bringing Kotkin after Stone."
20,"Having watched the Oli Stone interview, I have to say I really appreciate the diverse perspectives you have on the show, Lex.  Great stuff"
21,"Amazing interview, thank you for sharing!"
22,"Lex, you are a diamond in the rough.. Thank you for everything you do."
23,I enjoyed every minute of it! Just discovered Lex! Спасибо и блестяще!
24,Thanks for your work Lex!
25,This conversation is just fantastic. Thank you.
26,Heartfelt intro.  I feel but a piece of that tracing my ancestry that has history in both countries.  I lived in Moscow for a year and visited 3 weeks in Kiev.  I too have a heart for both and support your quest.  Godspeed Lex.
27,Thank you for putting out Stones and Kotkins interviews on this topic. Greetings from Germany!
28,"Moving intro Lex and appreciate the balancing  view., lovely man, Mr Kotkin. Tread carefully on your travels Lex this world needs good souls and intellects like you. Stay safe!"
29,"What a fantastic, insightful and very well articulated interview!"
30,Outstanding interview. Your podcast is second to none Lex. Keep up the great work.
31,Wow this guy is great! Such a good episode
32,"Wow, I really enjoyed this podcast without realizing this is outside my immediate interests. Thanks Lex and Stephen!"
33,"Lex podcasts are great,  love the way he allows the guest to have a platform to speak, I only wish he would push back more against all arguments. It seems there are too many opinions interjected in these discussions that go unchallenged."
34,Take a drink every time Stephen says “Lex”. You’ll have a 2-day hangover.
35,"Fascinating to hear after Stone. The objective vs. subjective view. It's interesting to imagine him talking about Russia when he mentions the United States, and vice versa."
36,Great interview! I truly appreciated hearing this.
37,Very one-sided interview and he contradicts himself a lot. I dont know how you guys are saying this is the best interview ever
38,"This is a very educational and great interview. No rush, good thoughts and positivity through the dialog. Thank you Lex and Stephen!"
39,"Very educational interview with a great mind. I listened to this interview twice. If nothing else Lex, you attract the greatest minds in western culture. You are learning too, keep up the good line up of guests for your interviews."
40,"Me, a Chinese, listening to him talking about China at 1 AM in the morning. I've watched all your clips about China and communism"
41,One of the greatest minds in contemporary geo politics. First time ive listened to a 2 hour plus podcast from beginning to end. A truly brilliant mind analysing some truly intricate problems.
42,Thank you so much! One of the greatest interviews I recently watched
43,"Thank you Stephen Kotkin, you are brilliant."
44,One of my favorite guests!
45,2:24:00 This part was funny. It's nice to have a response to Oliver Stone.
46,Your doing a wonderful job Lex. Thank you for the so interesting educational interviews .
47,"Another wonderful lecture, thank you Lex.  I am a little smarter now."
48,Awesome view you keep expanding in amazing ways the picture gets more clarity with every interaction
49,"Lex, thank you for this great interview.
You will probably have no problem with your visit to Ukraine."
50,"So this was really all about Lex Fridman. I knew it!!
Seriously, though. This was a great interview."
51,“Navalny is a second most important person” 
52,"Outstanding discussion.  Lex, you get the best guests and have the knowledge to ask insightful, meaningful questions."
53,"God Bless Lex, you are an awesome human being, we need more like you, stay vigilant & stay frosty brother!"
54,"Hey Lex, thanks for another great interview. You look sad or stressed, I hope you are alright. All the very best. You really are doing a great thing. Stephen Kotkin was a legend as always, I hope you have him on again."
55,Great interview sir!
56,Thanks for the show. This guys is good on the western media propaganda.
57,A breath of fresh air. Awesome 
58,"This was superb. Yet again.
I have not as yet experienced one Lex Podcast I didn't get to the end of.
Always interesting, insightful and refreshing."
59,"For some reason, I like to listen to this man go on long tangents on your Podcast, while you listen."
60,"This is amazing Lex, thanks a lot for this beautiful content."
61,Brilliant podcast!
62,"Lex, I can't tell you how refreshing it is to hear your conversations and for your calm presence in the midst of the chaotic life topics of discussions you present. Many heartfelt thanks."
63,"Came here from spotify to say this dude is based AF, great podcast!"
64,I love how Lex brings people on to present both perspectives of Russia's invasion of Ukraine. This was a fascinating podcast.
65,Lex has surpassed Rogan in terms of interviewing
66,"Downright incredible conversation. From just listening to Stephen, I know that his books are fantastic reads. His ability to explain complex geopolitical machinations (Putin’s calculations for continuing the war) was so clear and concise that a child could understand it."
67,"I’m learning more and more about Russia ,22 years ago I met a Russian paleontologist who is a United States citizen, when I ask her about Russia back then all she said was not good. She left Russia and became a United States citizen before I met her.   This guy is saying everything I’ve been thinking and I just started watching the stuff but I seen it now ."
68,Огромное спасибо!️‍
69,Excellent interview.
70,I hope that Prof. Kotkin will soon be able to finish the 3. (final) Vol. of his excellent Stalin biography. A great scientist. Thank you!
71,Very intellectual guest which takes good points in history and can se hole view of world.
72,"Get Victor Davis Hanson on the podcast, a classical historian would be very informative here and in general. I rate him on a par with Mr Kotkin, no disrespect implied at all. This is a superb episode."
73,Outstanding Interview Lex and incredibly insightful and informative. Keep up your amazing work
74,Thank you so much for your conversation!
75,Hi Lex! Really like your podcast and interesting guests. Joe Rogan's podcast used to be my favorite but nowadays he mostly has comics and fighters on which isn't nearly as interesting as the good ol' folks you're having on. Cheers.
76,"""NATO is a defensive alliance""  this guy is as full of it, as what he claims Oliver Stone to be"
77,"I can't believe he said ""Nato does not attack"""
78,"We love you too, Lex. You’re the voice of a generation. Keep doing what you’re doing and don’t let anyone or anything ever hold you back. Please be safe on your travels. The people need you."
79,"Thank you, Lex. You are a wonderful human. Much love from Bucharest."
80,Stephen is like the Joe Pesci of historians =)
81,Thank you Lex and Stephen. Much love!
82,"Dear Hanne your comments give me hope for the positive power of this net and the reach, impact and significance of what Lex brings to us. Thanks !"
83,He hasn't won this room over with his reality tv production.
84,"Thanks a lot Lex for both Mr Stone’s interview and Mr Kotkin’s interview.
It is great to be able to see both sides and try and understand the current circumstances with their help.
I wish you a great trip back to the land of your ancestors."
85,NATO is a defensive alliance? Some historian. Lybia? Serbia? Defensive?
86,One of the most informative and insightful interviews about this subject I have seen. Bravo 
87,"Fantastic interview, thank you both!"
88,he's the perfect antidote
89,Good job Mr Fridman
90,Wow! What an intro! Prayers up Lex! ️
91,"""All war is based on miscalculation, but not everybody is punished for their miscalculation"""
92,I read both of his books on Stalin since the last podcast. Huge fan of Kotkin!
93,I've been wondering if Putin has a favorite Tsar. I'm hoping it's Alexander the first
94,Great interview. Though Kotkin is even more fascinating to listen when speaking at his own pace from a podium.
95,"One of the most informational podcasts I have ever listened to regarding Ukraine.  Hearing about Putin, and his historical links to Stalin, was an amazing listen."
96,"stephen kotkin,thanks for your inside and wisdom."
97,"Good one Lex. I agree with the guy maybe 20%, but I’m glad I got to hear this."
98,Kotkin never disappoints. He understands things very well and doesnt mince words
99,Thanks for inviting him Lex Love from Poland
100,Would have been very interesting if Lex could interview John Mearsheimer on this subject as well.
101,"I love you all too, Lex Fridman.

Let’s keep the love going…. There’s nothing more important."
102,"I have listened to it twice now because it is that good. One of the best conversations, and probably the best conversation I have listened to over the Ukraine/Russia conflict."
103,Thank you Mr Kotkin
104,"Damnit Lex, you've done it again... GREAT podcast!"
105,Wow. Amazing interview. Thanks lex and thanks Stephen 
106,"This is the best podcast ever aired.  I am sending this link to all in my sphere.  Thank you, Lex."
107,"Only a Russian could give the introduction Lex opens this podcast with.
Best wishes"
108,Would love to see this guy debate Andrei Martyanov 
109,Thanks to Lex Fridman for this amazingly important and fascinating interview with Stephen Kopkin
110,Would love to see Maren Altman on the podcast.
111,If you had Steven on every week I’d be faithfully watching every episode. Thank you from the bottom of my heart. Touching ending ️
112,"Lex, your knocking out the park with these guests. Thanks you for your work. Much love brother."
113,"Be safe in your travels, Lex. YOU are one my favorite human beings, despite not knowing you in person. Keep bringing light to the world."
114,"You’re a light in this world allowed us to learn and explore.
"
115,Great interview! Thank you for the enlightenment you have brought to me!
116,Sharing this excellent histrionic piece.
117,"Essential follow up to the Oliver Stone interview. Thank you for the balance Lex and humility not to colour the experts’ voices.  Subsequently, I come away with the perspective that Stone’s assessment, whilst well-informed on a first-hand basis is, as a result, deeply biased and without historical foundation."
118,Excellent interview and the mutual respect is apparent. Well done and thank you!
119,Lex is delivering on educators that Joe lacks nowadays.  Keep it up!!!
120,"Your fusion of humility, compassion and sensitivity is evolving the phenomena of podcast interviewing. It’s attuned to a global intellectual zeitgeist. Compulsive listening every time. 

This interview is another treasure: nearly three hours of Kotkin’s acute analysis and insight.

We might not agree with everything he says but his knowledge imparted to us - for free - is priceless. The same can be said of many of your guests.

Lex, do not underestimate the contribution your podcasts are making across the globe. For this we are hugely appreciative. 

Your emotional investment in Ukraine - Russia is particularly heart-wrenching. We implore you to stay safe as you travel both countries, and we understand your desire to embark on this journey. Trust you will find what you’re searching for and give support to those you visit.

Ultimately, we look forward to your return, your insights and your continued expansion of our knowledge via your interviews. 

I write from Africa and end off with an ancient farewell that we say to a friend when departing: “Walk gently. Walk in peace.”"
121,Oliver Stone is no expert...keep the experts coming
122,"Watching and listening to ""Eli from Russia"" gives me a better understanding of life and happenings in Russia than this Kotkin guy."
123,Incredible interview - thanks Lex!
124,"Mr. Kotlin's patience is also admirable, the way he gently, kindly corrects the flawed questions, the same way a loving father tries to educate his slightly idiotic son."
125,Mr. Kotkin always has me riveted!
126,"This introduction and ending brought me to tears. This was not just an insightful conversation with good historic information, but raw, courageous sense of impending potential uncertainty. Thanks for sharing this one Lex."
127,Thank you for your work! From Russia with love :)
128,Thank you . This was an incredible interview
129,That intro about Mr. Fridman traveling to Russia/Ukraine hits hard.
130,For a second I was worried he might not remember Lex's name.
131,Kotkin seems totally unable to see the world from a global south perspective.
132,This was the best episode yet. As someone who enjoyed the original focus on machine learning it’s great to see this transcend into something so much more. Great job and amazing guest.
133,"I need to start watching these interviews instead of just listening, this whole time I thought this was Joe Pesci!"
134,Coming from the Oli Stone interview. Really nice to get both sides. Media tends to skew things and yet i get a sense i can trust Lex here.
135,"37:30 Agree with most of the podcast so far, except comparing the invasion to a woman in New York.."
136,Really enjoyed this one even though the discussed topics were often very sad.
137,Again top class quality!!!!
138,Thanks for this. Love his first interview and I've been wanting to hear his thoughts on everything happening
139,The loop of insanity may have been introduced in the middle but in the mind it has been extended prior the beginning and requires examination and resolve to exit the beaten path of humanity
140,"What a fabulous interview.  I've been watching two years now, and catching up on old ones, this is one of the best I've seen. Stephen Kotkin just lays it all out and seemed to be spot on in almost everything he said."
141,The first 10 minutes tell you everything you need to know about Russia.
142,I would be great to see Kotkin and Stone discussing these relevant political issues in one room and producing insights mediated by Lex. Two brilliant separate interviews regardless.
143,"For me, more common sense that what Oliver Stone offered."
144,"Great interview, I couldn’t agree more with everything he was saying to include the US in Iraq in 2003. I was there with 1st Mar Div 3/12 L battery I was a gunner artillery crew member, the war was a complete waste of human life, we created the vacuum that formed ISIS. As Americans we own this. However Russia is basically taken Americas reasoning for war to justify the war in Ukraine just listen to their media and how they’re selling it."
145,"It is beautiful almost to watch two people I respect greatly show so much humility and respect toward each other.
Intelligent conversation is how we get beyond the strife.
Thank you both for moving the world forward with this conversation."
146,"I'm grateful to have known you as a professional, as well as a human being, using this podcast a tool to see the war through yours and others perspective. You are a great man who seems to understand the true consequences of your direct action. Regardless, this makes you authentic, leagues above the rest in terms of dignity and respect. Please continue to do greatness my friend, it suits you well."
147,Thx for the content! its a valueable opinion.
148,Wow I read one of his books when I took a seminar on Russian history.
149,This man is right on and I️ like how he doesn’t accept the bs justification pushed by pro-Russian agents and sympathizers.
150,Prof Kotkin has terrific insight into  Putin and this horrendous war....great teatcher!
151,I love how he is saying ‘lex’ hahahaha
152,"Thank you Lex for this interview. I disagreed hard with Oliver Stone, yet it was important to do it.  Please continue covering this and other topics, you are probably one of the best interviewers out there right now."
153,"Thank you for sharing this conversation.

I think Kotkin is really downplaying how influential the invasion of Yugoslavia in directing Putin's decisions.

I think the west has more responsibility to bear than we would like. Much like the rise of Hitler, neighbouring countries had a big role to play in his ascention."
154,Worth every minute!
155,"Bring Yanis Varoufakis on your podcast if possible. He has a good insight on Russia - Ukraine war and global order that leads to it. Also, he is an economist."
156,Lex I would say bringing the Oliver interview is good
157,Brilliant conversation! And once again Fridman allows the guest to speak instead of constantly interrupting and reducing complicated ideas to sound clips.
158,Amazing interview Lex  I'm always interested in people who are educated in Soviet history. Keep doing what you are doing. Thank you
159,"I met an 87 year old Ukrainian immigrant the other day.  He came here to California from Odessa 30 years ago. We worked as election volunteers together in Los Angeles. He spoke Russian much better than English. When asked how he felt about the conflict, he stated he didn't like what Zelinsky was doing.  He grew up in the USSR and always identified as Russian.  He's also Jewish, but identifies first as Russian. He said he understands why Russia felt threatened.  He's very aware of fascism in Ukraine.  Perhaps if he saw this video cast, he's change his mind.

3"
160,"This must be one of the best interviews of all times, all dimensions and galaxies!! This man is a living encyclopedia and knows how to communicate."
161,"The ""metaphor"" of the rape was so off, it was hard for me to take him seriously after he said this.  Having said that the man does have a lot of valuable information.  Will listen to this again."
162,"My favorite, so far."
163,"Keep it coming! It takes Courage!
But be it Stone or others.....always viewed through Neo liberal sunglasses.Try a different shade... that takes Courage too."
164,Is this man a historian or a hypnotist? It took two hours but I really liked when he finally opened up in hour two. The world like conversations are complicated and sometimes difficult. Maybe we should stop putting time limits on conversations so we can get to the humanity. Sincerely
165,"It's interesting to note that in 1991, when Ukrainians voted on whether or not to leave the USSR, the vote in favor of independence was also in the 90%+ range. Zelensky is popular because his actions are in line with the will of the Ukrainian people. Yanukovich got ousted because he tried to thwart it."
166,"Fascinating, passionate, knowledgeable speaker. Really enjoyed this."
167,"I wonder if Prof. Kotkin's description of Iran's leader as being ""whatever incarnation of the the supreme leader"" was a dig at both Khomeini and Khamenei because both of them have helped to destroy what was once a country that was flourishing and on their way to big success in the mold of a South Korea."
168,He sure likes Lex! Great interview btw.
169,I was also struggling to think of what you were gonna say to the rape analogy.... Very good interview 
170,I close my eyes and wonder how Joe Pesci finds the time.
171,"Heavy material!!! Thanks,"
172,"What a great way to explain everything! I am with this man 100%, thank you so much for inviting him!"
173,"This channel is a refuge for intellectuals, philosophers, artists and those on the scientific  rim.  Always thought provoking, invariably deep and utterly amazing. Do you ever sleep?"
174,My new favorite podcast!
175,"Almost every single argument he makes against russia, you could make identically against the usa"
176,"Stalin must be one of the most interesting characters in history and I only managed to read half of the first book of his biography how could an author make such an interesting life so boring, it takes a certain talent."
177,"Be safe Lex, this world needs you…"
178,The excellent timing of this interview as the geopolitical and economical world is entering a very dangerous and difficult period ahead. Let us hope that the Worlds  leaders have studied history and will not commit mistakes that dragged humanity to two devastatingWorld wars
179,Kotkin is pure wisdom. Maybe we should have him take a talk with Putin and Lavrov?
180,"Great interview, will need another when/if the war reaches a conclusion"
181,Great podcast!
182,Mr Stephen is one of the few brilliant minds of today world !!!
183,"Spicoli said, ""Learning about Russia. Having some food."""
184,"Thx for this amazing session with Mr Kotkin Lex. An amazing follow up from Mr Stone, two excellent episodes. My only complaint it didn’t go long enough! I could listen to Mr Kotkin and his knowledge on Russia/Ukraine and the world in general for hours."
